{
  "version": 2,
  "command": "review",
  "module": "review_v2",
  "identity_scheme": "nauqtype.semantic.v1",
  "functions": [
    {
      "id": "fn:review_v2::helper",
      "kind": "function",
      "qualified_name": "review_v2::helper",
      "module": "review_v2",
      "name": "helper",
      "public": true,
      "span": { "start": 7 },
      "audit": {
        "intent": "Print a helper line",
        "mutates": [],
        "effects": [
          "print"
        ],
        "propagates": []
      },
      "inferred": {
        "mutates": [],
        "effects": [
          "print"
        ],
        "propagates": []
      },
      "evidence": {
        "audit": "declared",
        "inferred": "checked"
      },
      "calls": [
        {
          "id": "call:review_v2::helper@110",
          "name": "print_line",
          "target_kind": "builtin",
          "target_id": "builtin:print_line",
          "target_module": "__builtin__",
          "evidence": "builtin",
          "span": { "start": 110 }
        }
      ]
    },
    {
      "id": "fn:review_v2::main",
      "kind": "function",
      "qualified_name": "review_v2::main",
      "module": "review_v2",
      "name": "main",
      "public": false,
      "span": { "start": 146 },
      "audit": {
        "intent": "Call helper",
        "mutates": [],
        "effects": [
          "print"
        ],
        "propagates": []
      },
      "inferred": {
        "mutates": [],
        "effects": [
          "print"
        ],
        "propagates": []
      },
      "evidence": {
        "audit": "declared",
        "inferred": "checked"
      },
      "calls": [
        {
          "id": "call:review_v2::main@238",
          "name": "helper",
          "target_kind": "function",
          "target_id": "fn:review_v2::helper",
          "target_module": "review_v2",
          "evidence": "checked",
          "span": { "start": 238 }
        }
      ]
    }
  ],
  "references": [
    {
      "id": "call:review_v2::helper@110",
      "kind": "call",
      "from": "fn:review_v2::helper",
      "name": "print_line",
      "target_kind": "builtin",
      "target_id": "builtin:print_line",
      "evidence": "builtin",
      "span": { "start": 110 }
    },
    {
      "id": "call:review_v2::main@238",
      "kind": "call",
      "from": "fn:review_v2::main",
      "name": "helper",
      "target_kind": "function",
      "target_id": "fn:review_v2::helper",
      "evidence": "checked",
      "span": { "start": 238 }
    }
  ],
  "call_graph": [
    {
      "caller": "fn:review_v2::helper",
      "callee": "builtin:print_line",
      "call_site": "call:review_v2::helper@110",
      "evidence": "builtin"
    },
    {
      "caller": "fn:review_v2::main",
      "callee": "fn:review_v2::helper",
      "call_site": "call:review_v2::main@238",
      "evidence": "checked"
    }
  ],
  "propagation_sites": []
}
